{
  "$schema": "https://json-schema.org/draft/2020-12/schema",
  "$id": "https://example.com/hacklab/preview_manifest.schema.json",
  "title": "Hacklab Preview Bundle Manifest",
  "description": "P2-14 offline-only manifest for already-persisted dry-run preview bundles. This contract binds four fixed JSON artifacts by path, SHA-256, and byte size; it does not authorize module execution, scanning, network access, target touching, findings, evidence, reports, callbacks, or repairs.",
  "type": "object",
  "additionalProperties": false,
  "required": [
    "schema_version",
    "run_id",
    "created_at_utc",
    "producer",
    "preview_mode",
    "bundle_consistency",
    "artifacts"
  ],
  "properties": {
    "schema_version": { "type": "string", "const": "preview_manifest/1.0" },
    "run_id": { "$ref": "#/$defs/run_id" },
    "created_at_utc": { "$ref": "#/$defs/utc_timestamp" },
    "producer": {
      "type": "object",
      "additionalProperties": false,
      "required": ["name", "version"],
      "properties": {
        "name": { "type": "string", "const": "module_runner" },
        "version": { "type": "string", "pattern": "^[0-9]+\\.[0-9]+\\.[0-9]+(?:[-+][A-Za-z0-9._-]+)?$" }
      }
    },
    "preview_mode": {
      "type": "object",
      "additionalProperties": false,
      "required": ["persist_preview_bundle", "include_module_io_preview", "dry_run"],
      "properties": {
        "persist_preview_bundle": { "type": "boolean", "const": true },
        "include_module_io_preview": { "type": "boolean", "const": true },
        "dry_run": { "type": "boolean", "const": true }
      }
    },
    "bundle_consistency": {
      "type": "object",
      "additionalProperties": false,
      "required": ["status", "verdict", "relative_path", "sha256"],
      "properties": {
        "status": { "type": "string", "const": "ok" },
        "verdict": { "type": "string", "const": "allow" },
        "relative_path": { "$ref": "#/$defs/bundle_consistency_path" },
        "sha256": { "$ref": "#/$defs/sha256" }
      }
    },
    "artifacts": {
      "type": "array",
      "minItems": 4,
      "maxItems": 4,
      "items": { "$ref": "#/$defs/artifact" }
    }
  },
  "$defs": {
    "run_id": { "type": "string", "pattern": "^[A-Za-z0-9][A-Za-z0-9._-]{2,127}$" },
    "sha256": { "type": "string", "pattern": "^[0-9a-f]{64}$" },
    "utc_timestamp": { "type": "string", "pattern": "^\\d{4}-\\d{2}-\\d{2}T\\d{2}:\\d{2}:\\d{2}Z$" },
    "artifact_name": {
      "type": "string",
      "enum": [
        "run.json",
        "module_inputs.json",
        "module_results.json",
        "bundle_consistency.json"
      ]
    },
    "artifact_path": {
      "type": "string",
      "pattern": "^runs/[A-Za-z0-9][A-Za-z0-9._-]{2,127}/preview/(run|module_inputs|module_results|bundle_consistency)\\.json$",
      "not": { "pattern": "(^|/)\\.\\.(/|$)|(^|/)\\.(/|$)|//|\\\\" }
    },
    "bundle_consistency_path": {
      "type": "string",
      "pattern": "^runs/[A-Za-z0-9][A-Za-z0-9._-]{2,127}/preview/bundle_consistency\\.json$",
      "not": { "pattern": "(^|/)\\.\\.(/|$)|(^|/)\\.(/|$)|//|\\\\" }
    },
    "artifact": {
      "type": "object",
      "additionalProperties": false,
      "required": ["name", "relative_path", "sha256", "size_bytes", "content_type"],
      "properties": {
        "name": { "$ref": "#/$defs/artifact_name" },
        "relative_path": { "$ref": "#/$defs/artifact_path" },
        "sha256": { "$ref": "#/$defs/sha256" },
        "size_bytes": { "type": "integer", "minimum": 0 },
        "content_type": { "type": "string", "const": "application/json" }
      }
    }
  }
}
